,message,label
843,Just chill for another 6hrs. If you could sleep the pain is not a surgical emergency so see how it unfolds. Okay,0
844,Crazy ar he's married. __ like gd looking guys not me. My frens like say he's korean leona's fave but i dun thk he is. Aft some thinking mayb most prob i'll go.,0
845,Were somewhere on Fredericksburg,0
846,Que pases un buen tiempo or something like that,0
847,Is it ok if I stay the night here? Xavier has a sleeping bag and I'm getting tired,0
848,She doesnt need any test.,0
849,"Nothing much, chillin at home. Any super bowl plan?",0
850,"FREE2DAY sexy St George's Day pic of Jordan!Txt PIC to 89080 dont miss out, then every wk a saucy celeb!4 more pics c PocketBabe.co.uk 0870241182716 å£3/wk",1
851,Bugis oso near wat... ,0
852,Let Ur Heart Be Ur Compass Ur Mind Ur Map Ur Soul Ur Guide And U Will Never loose in world....gnun - Sent via WAY2SMS.COM,0
853,U ned to convince him tht its not possible witot hurting his feeling its the main,0
854,Yo dude guess who just got arrested the other day,0
855,What does the dance river do?,0
856,"Yetunde, i'm sorry but moji and i seem too busy to be able to go shopping. Can you just please find some other way to get what you wanted us to get. Please forgive me. You can reply free via yahoo messenger.",0
857,Hey i will be really pretty late... You want to go for the lesson first? I will join you. I'm only reaching tp mrt,0
858,"HOT LIVE FANTASIES call now 08707509020 Just 20p per min NTT Ltd, PO Box 1327 Croydon CR9 5WB 0870..k",1
859,Alright. I'm out--have a good night!,0
860,Hope you are feeling great. Pls fill me in. Abiola,0
861,"1) Go to write msg 2) Put on Dictionary mode 3)Cover the screen with hand, 4)Press  &lt;#&gt; . 5)Gently remove Ur hand.. Its interesting..:)",0
862,"Bears Pic Nick, and Tom, Pete and ... Dick. In fact, all types try gay chat with photo upload call 08718730666 (10p/min). 2 stop texts call 08712460324",1
863,"500 New Mobiles from 2004, MUST GO! Txt: NOKIA to No: 89545 & collect yours today!From ONLY å£1 www.4-tc.biz 2optout 087187262701.50gbp/mtmsg18 TXTAUCTION",1
864,We're finally ready fyi,0
865,Auntie huai juan never pick up her phone,0
866,Double Mins & Double Txt & 1/2 price Linerental on Latest Orange Bluetooth mobiles. Call MobileUpd8 for the very latest offers. 08000839402 or call2optout/LF56,1
867,"Ya tel, wats ur problem..",0
868,No. 1 Nokia Tone 4 ur mob every week! Just txt NOK to 87021. 1st Tone FREE ! so get txtin now and tell ur friends. 150p/tone. 16 reply HL 4info,1
869,i dnt wnt to tlk wid u,0
870,Please reserve ticket on saturday eve from chennai to thirunelvali and again from tirunelvali to chennai on sunday eve...i already see in net..no ticket available..i want to book ticket through tackle ..,0
871,That's ok. I popped in to ask bout something and she said you'd been in. Are you around tonght wen this girl comes?,0
872,Hope ur head doesn't hurt 2 much ! Am ploughing my way through a pile of ironing ! Staying in with a chinky tonight come round if you like.,0
873,Oh k.i think most of wi and nz players unsold.,0
874,"Haha... Where got so fast lose weight, thk muz go 4 a month den got effect... Gee,later we go aust put bk e weight.",0
875,"I wonder how you got online, my love ? Had you gone to the net cafe ? Did you get your phone recharged ? Were you on a friends net ? I think of you, boytoy",0
876,"Thk shld b can... Ya, i wana go 4 lessons... Haha, can go for one whole stretch...",0
877,Thats cool! I am a gentleman and will treat you with dignity and respect.,0
878,Then we wait 4 u lor... No need 2 feel bad lar...,0
879,No did you check? I got his detailed message now,0
880,You have registered Sinco as Payee. Log in at icicibank.com and enter URN  &lt;#&gt;  to confirm. Beware of frauds. Do NOT share or disclose URN to anyone.,0
881,"No, I decided that only people who care about stuff vote and caring about stuff is for losers",0
882,You have registered Sinco as Payee. Log in at icicibank.com and enter URN  &lt;#&gt;  to confirm. Beware of frauds. Do NOT share or disclose URN to anyone.,0
883,cool. We will have fun practicing making babies!,0
884,Actually getting ready to leave the house.,0
885,Then we gotta do it after that,0
886,"I've got ten bucks, jay is being noncomittal",0
887,Where at were hungry too,0
888,Pls speak to that customer machan.,0
889,somewhere out there beneath the pale moon light someone think in of u some where out there where dreams come true... goodnite &amp; sweet dreams,0
890,Dear U've been invited to XCHAT. This is our final attempt to contact u! Txt CHAT to 86688 150p/MsgrcvdHG/Suite342/2Lands/Row/W1J6HL LDN 18 yrs,1
891,So wats ur opinion abt him and how abt is character?,0
892,Jay is snickering and tells me that x is totally fucking up the chords as we speak,0
893,No wonder... Cos i dun rem seeing a silver car... But i thk i saw a black one...,0
894,Lmao. Take a pic and send it to me.,0
895,No. She's currently in scotland for that.,0
896,Do you work all this week ?,0
897,Congratulations ur awarded either å£500 of CD gift vouchers & Free entry 2 our å£100 weekly draw txt MUSIC to 87066 TnCs www.Ldew.com 1 win150ppmx3age16,1
898,Lol great now im getting hungry.,0
899,Yes.. now only saw your message..,0
900,THING R GOOD THANX GOT EXAMS IN MARCH IVE DONE NO REVISION? IS FRAN STILL WITH BOYF? IVE GOTTA INTERVIW 4 EXETER BIT WORRIED!x,0
901,For sale - arsenal dartboard. Good condition but no doubles or trebles!,1
902,Don't look back at the building because you have no coat and i don't want you to get more sick. Just hurry home and wear a coat to the gym!!!,0
903,I asked sen to come chennai and search for job.,0
904,Dad went out oredi... ,0
905,"I jus hope its true that  missin me cos i'm really missin him! You haven't done anything to feel guilty about, yet.",0
906,Wat so late still early mah. Or we juz go 4 dinner lor. Aiya i dunno...,0
907,"Cool breeze... Bright sun... Fresh flower... Twittering birds... All these waiting to wish u: \GOODMORNING &amp; HAVE A NICE DAY\"" :)""",0
908,Ya:)going for restaurant..,0
909,"Its ok., i just askd did u knw tht no?",0
910,Free 1st week entry 2 TEXTPOD 4 a chance 2 win 40GB iPod or å£250 cash every wk. Txt POD to 84128 Ts&Cs www.textpod.net custcare 08712405020.,1
911,Those ducking chinchillas,0
912,I am in a marriage function,0
913,Looks like u wil b getting a headstart im leaving here bout 2.30ish but if u r desperate for my company I could head in earlier-we were goin to meet in rummer.,0
914,As a registered optin subscriber ur draw 4 å£100 gift voucher will be entered on receipt of a correct ans to 80062 Whats No1 in the BBC charts,1
915,say thanks2. ,0
916,"That's good, because I need drugs",0
917,Stupid.its not possible,0
918,Can __ all decide faster cos my sis going home liao..,0
919,Summers finally here! Fancy a chat or flirt with sexy singles in yr area? To get MATCHED up just reply SUMMER now. Free 2 Join. OptOut txt STOP Help08714742804,1
920,CLAIRE here am havin borin time & am now alone U wanna cum over 2nite? Chat now 09099725823 hope 2 C U Luv CLAIRE xx Callså£1/minmoremobsEMSPOBox45PO139WA,1
921,"Fighting with the world is easy, u either win or lose bt fightng with some1 who is close to u is dificult if u lose - u lose if u win - u still lose.",0
922,Bought one ringtone and now getting texts costing 3 pound offering more tones etc,1
923,Kinda. First one gets in at twelve! Aah. Speak tomo,0
924,"09066362231 URGENT! Your mobile No 07xxxxxxxxx won a å£2,000 bonus caller prize on 02/06/03! this is the 2nd attempt to reach YOU! call 09066362231 ASAP!",1
925,Wat makes u thk i'll fall down. But actually i thk i'm quite prone 2 falls. Lucky my dad at home i ask him come n fetch me already.,0
926,"YOU 07801543489 are guaranteed the latests Nokia Phone, a 40GB iPod MP3 player or a å£500 prize! Txt word:COLLECT to No:83355! TC-LLC NY-USA 150p/Mt msgrcvd18+",1
927,Your account has been refilled successfully by INR  &lt;DECIMAL&gt; . Your KeralaCircle prepaid account balance is Rs  &lt;DECIMAL&gt; . Your Transaction ID is KR &lt;#&gt; .,0
928,I wont touch you with out your permission.,0
929,"7 wonders in My WORLD 7th You 6th Ur style 5th Ur smile 4th Ur Personality 3rd Ur Nature 2nd Ur SMS and 1st \Ur Lovely Friendship\""... good morning dear""",0
930,Oh. U must have taken your REAL Valentine out shopping first.,0
931,"Just sent you an email ___ to an address with incomm in it, is that right?",0
932,"Will do, you gonna be at blake's all night? I might be able to get out of here a little early",0
933,Why you keeping me away like this,0
934,I think its far more than that but find out. Check google maps for a place from your dorm.,0
935,My trip was ok but quite tiring lor. Uni starts today but it's ok 4 me cos i'm not taking any modules but jus concentrating on my final yr project.,0
936,"I'm a guy, browsin is compulsory",0
937,Purity of friendship between two is not about smiling after reading the forwarded message..Its about smiling just by seeing the name. Gud evng musthu,0
938,"Sorry, I'll call later",0
939,"(I should add that I don't really care and if you can't I can at least get this dude to fuck off but hey, your money if you want it)",0
940,I told your number to gautham..,0
941,Tell them no need to investigate about me anywhere.,0
942,"Your account has been credited with 500 FREE Text Messages. To activate, just txt the word: CREDIT to No: 80488 T&Cs www.80488.biz",1
943,In the end she might still vomit but its okay. Not everything will come out.,0
944,It has everything to do with the weather. Keep extra warm. Its a cold but nothing serious. Pls lots of vitamin c,0
945,Hey gals.. Anyone of u going down to e driving centre tmr?,0
946,I'm putting it on now. It should be ready for  &lt;TIME&gt; ,0
947,Host-based IDPS for linux systems.,0
948,"HOT LIVE FANTASIES call now 08707509020 Just 20p per min NTT Ltd, PO Box 1327 Croydon CR9 5WB 0870 is a national rate call",1
949,Ill be there on  &lt;#&gt;  ok.,0
950,Oh my God. I'm almost home,0
951,"Wen ur lovable bcums angry wid u, dnt take it seriously.. Coz being angry is d most childish n true way of showing deep affection, care n luv!.. kettoda manda... Have nice day da.",0
952,Sounds like something that someone testing me would sayy,0
953,"Pete,is this your phone still? Its Jenny from college and Leanne.what are you up to now?:)",0
954,Oops sorry. Just to check that you don't mind picking me up tomo at half eight from station. Would that be ok?,0
955,"Hey sweet, I was wondering when you had a moment if you might come to me ? I want to send a file to someone but it won't go over yahoo for them because their connection sucks, remember when you set up that page for me to go to and download the format disc ? Could you tell me how to do that ? Or do you know some other way to download big files ? Because they can download stuff directly from the internet. Any help would be great, my prey ... *teasing kiss*",0
956,Hows the champ just leaving glasgow!,0
957,I need to come home and give you some good lovin...,0
958,Shall i ask one thing if you dont mistake me.,0
959,Check wid corect speling i.e. Sarcasm,0
960,"URGENT! Your Mobile No was awarded a å£2,000 Bonus Caller Prize on 1/08/03! This is our 2nd attempt to contact YOU! Call 0871-4719-523 BOX95QU BT National Rate",1
961,Hi:)cts employee how are you?,0
962,Pls pls find out from aunt nike.,0
963,No screaming means shouting..,0
964,Should I have picked up a receipt or something earlier,0
965,I think chennai well settled?,0
966,Horrible bf... I now v hungry...,0
967,How's it feel? Mr. Your not my real Valentine just my yo Valentine even tho u hardly play!!,0
968,Midnight at the earliest,0
969,You're not sure that I'm not trying to make xavier smoke because I don't want to smoke after being told I smoke too much?,0
970,Do u konw waht is rael FRIENDSHIP Im gving yuo an exmpel: Jsut ese tihs msg.. Evrey splleing of tihs msg is wrnog.. Bt sitll yuo can raed it wihtuot ayn mitsake.. GOODNIGHT &amp; HAVE A NICE SLEEP..SWEET DREAMS..,0
971,Now press conference da:),0
972,"Hello from Orange. For 1 month's free access to games, news and sport, plus 10 free texts and 20 photo messages, reply YES. Terms apply: www.orange.co.uk/ow",1
973,After completed degree. There is no use in joining finance.,0
974,"Good afternoon, my love ! Any job prospects ? Are you missing me ? What do you do ? Are you being lazy and bleak, hmmm ? Or happy and filled with my love ?",0
975,Shant disturb u anymore... Jia you...,0
976,"Me, i dont know again oh",0
977,Dude sux for snake. He got old and raiden got buff,0
978,He says hi and to get your ass back to south tampa (preferably at a kegger),0
979,In e msg jus now. U said thanks for gift.,0
980,U too...,0
981,Ok how you dear. Did you call chechi,0
982,Ok i found dis pierre cardin one which looks normal costs 20 its on sale.,0
983,Message from . I am at Truro Hospital on ext. You can phone me here. as I have a phone by my side,0
984,"Single line with a big meaning::::: \Miss anything 4 ur \""Best Life\"" but",0
985,Dnt worry...use ice pieces in a cloth pack.also take 2 tablets.,0
986,Dude just saw a parked car with its sunroof popped up. Sux,0
987,"The  &lt;#&gt; g that i saw a few days ago, the guy wants sell wifi only for  &lt;#&gt;  and with 3g for  &lt;#&gt; . That's why i blanked him.",0
988,Today is ACCEPT DAY..U Accept me as? Brother Sister Lover Dear1 Best1 Clos1 Lvblefrnd Jstfrnd Cutefrnd Lifpartnr Belovd Swtheart Bstfrnd No rply means enemy,0
989,I dont have that much image in class.,0
990,No:-)i got rumour that you going to buy apartment in chennai:-),0
991,Near kalainar tv office.thenampet,0
992,SMS AUCTION - A BRAND NEW Nokia 7250 is up 4 auction today! Auction is FREE 2 join & take part! Txt NOKIA to 86021 now! HG/Suite342/2Lands Row/W1J6HL,1
993,No. To be nosy I guess. Idk am I over reacting if I'm freaked?,0
994,"Remember all those whom i hurt during days of satanic imposter in me.need to pay a price,so be it.may destiny keep me going and as u said pray that i get the mind to get over the same.",0
995,How to Make a girl Happy? It's not at all difficult to make girls happy. U only need to be... 1. A friend 2. Companion 3. Lover 4. Chef . . .  &lt;#&gt; . Good listener  &lt;#&gt; . Organizer  &lt;#&gt; . Good boyfriend  &lt;#&gt; . Very clean  &lt;#&gt; . Sympathetic  &lt;#&gt; . Athletic  &lt;#&gt; . Warm . . .  &lt;#&gt; . Courageous  &lt;#&gt; . Determined  &lt;#&gt; . True  &lt;#&gt; . Dependable  &lt;#&gt; . Intelligent . . .  &lt;#&gt; . Psychologist  &lt;#&gt; . Pest exterminator  &lt;#&gt; . Psychiatrist  &lt;#&gt; . Healer . .  &lt;#&gt; . Stylist  &lt;#&gt; . Driver . . Aaniye pudunga venaam..,0
996,"Yep, at derek's house now, see you Sunday &lt;3",0
997,"Sorry, I'll call later",0
998,There are no other charges after transfer charges and you can withdraw anyhow you like,0
999,"Dont search love, let love find U. Thats why its called falling in love, bcoz U dont force yourself, U just fall and U know there is smeone to hold U... BSLVYL",0
1000,I love you. You set my soul on fire. It is not just a spark. But it is a flame. A big rawring flame. XoXo,0
1001,"Somewhr someone is surely made 4 u. And God has decided a perfect time to make u meet dat person. . . . till den, . . . . . Enjoy ur crushes..!!!;-)",0
1002,That's my honeymoon outfit. :),0
1003,Never blame a day in ur life. Good days give u happiness. Bad days give u experience. Both are essential in life! All are Gods blessings! good morning.:,0
1004,Pls confirm the time to collect the cheque.,0
1005,URGENT! Your Mobile number has been awarded with a å£2000 prize GUARANTEED. Call 09061790121 from land line. Claim 3030. Valid 12hrs only 150ppm,1
1006,"Yeah probably, I still gotta check out with leo",0
1007,K.then any other special?,0
1008,Carlos is taking his sweet time as usual so let me know when you and patty are done/want to smoke and I'll tell him to haul ass,0
1009,Ok pa. Nothing problem:-),0
1010,"God picked up a flower and dippeditinaDEW, lovingly touched itwhichturnedinto u, and the he gifted tomeandsaid,THIS FRIEND IS 4U",0
1011,When you came to hostel.,0
1012,Ok no prob... I'll come after lunch then...,0
1013,Jus telling u dat i'll b leaving 4 shanghai on 21st instead so we'll haf more time 2 meet up cya...,0
1014,Are your freezing ? Are you home yet ? Will you remember to kiss your mom in the morning? Do you love me ? Do you think of me ? Are you missing me yet ?,0
1015,You all ready for * big day tomorrow?,0
1016,Me sef dey laugh you. Meanwhile how's my darling anjie!,0
1017,Mm i had my food da from out,0
1018,"K, makes sense, btw carlos is being difficult so you guys are gonna smoke while I go pick up the second batch and get gas",0
1019,The 2 oz guy is being kinda flaky but one friend is interested in picking up $ &lt;#&gt;  worth tonight if possible,0
1020,"Fuck babe, I miss you sooooo much !! I wish you were here to sleep with me ... My bed is so lonely ... I go now, to sleep ... To dream of you, my love ...",0
1021,Dear how you. Are you ok?,0
1022,"You have been selected to stay in 1 of 250 top British hotels - FOR NOTHING! Holiday Worth å£350! To Claim, Call London 02072069400. Bx 526, SW73SS",1
1023,Yes princess! I want to make you happy...,0
1024,Sounds like you have many talents! would you like to go on a dinner date next week?,0
1025,I am going to film 2day da. At 6pm. Sorry da.,0
1026,Yesterday its with me only . Now am going home.,0
1027,"No shit, but I wasn't that surprised, so I went and spent the evening with that french guy I met in town here and we fooled around a bit but I didn't let him fuck me",0
1028,"0A$NETWORKS allow companies to bill for SMS, so they are responsible for their \suppliers\""",1
1029,Great comedy..cant stop laughing da:),0
1030,FreeMsg:Feelin kinda lnly hope u like 2 keep me company! Jst got a cam moby wanna c my pic?Txt or reply DATE to 82242 Msg150p 2rcv Hlp 08712317606 stop to 82242,1
1031,"Alright, we're all set here, text the man",0
1032,"Hi , where are you? We're at  and they're not keen to go out i kind of am but feel i shouldn't so can we go out tomo, don't mind do you?",0
1033,India have to take lead:),0
1034,I.ll post her out l8r. In class,0
1035,ITS A LAPTOP TAKE IT WITH YOU.,0
1036,I dont have any of your file in my bag..i was in work when you called me.i 'll tell you if i find anything in my room.,0
1037,I wan but too early lei... Me outside now wun b home so early... Neva mind then...,0
1038,"For ur chance to win a å£250 cash every wk TXT: ACTION to 80608. T's&C's www.movietrivia.tv custcare 08712405022, 1x150p/wk",1
1039,"Wishing you and your family Merry \X\"" mas and HAPPY NEW Year in advance..""",0
1040,At 7 we will go ok na.,0
1041,Yes I posted a couple of pics on fb. There's still snow outside too. I'm just waking up :),0
1042,"Yeah, where's your class at?",0
1043,No just send to you. Bec you in temple na.,0
1044,"You aren't coming home between class, right? I need to work out and shower!",0
1045,Hi if ur lookin 4 saucy daytime fun wiv busty married woman Am free all next week Chat now 2 sort time 09099726429 JANINExx Callså£1/minMobsmoreLKPOBOX177HP51FL,1
1046,S but mostly not like that.,0
1047,__ v ma fan...,0
1048,Dunno cos i was v late n when i reach they inside already... But we ate spageddies lor... It's e gals who r laughing at me lor...,0
1049,Guess who spent all last night phasing in and out of the fourth dimension,0
1050,So now my dad is gonna call after he gets out of work and ask all these crazy questions.,0
1051,Lmao!nice 1,0
1052,URGENT! We are trying to contact U. Todays draw shows that you have won a å£800 prize GUARANTEED. Call 09050001295 from land line. Claim A21. Valid 12hrs only,1
1053,Monthly password for wap. mobsi.com is 391784. Use your wap phone not PC.,1
1054,Nah dub but je still buff,0
1055,"Yeah, that's fine! It's å£6 to get in, is that ok? ",0
1056,Lol where do u come up with these ideas?,0
1057,"Today is \song dedicated day..\"" Which song will u dedicate for me? Send this to all ur valuable frnds but first rply me...""",0
1058,Okay... We wait ah,0
1059,Y lei?,0
1060,Already am squatting is the new way of walking,0
1061,Cramps stopped. Going back to sleep,0
1062,Free Top ringtone -sub to weekly ringtone-get 1st week free-send SUBPOLY to 81618-?3 per week-stop sms-08718727870,1
1063,Bring tat cd don forget,0
1064,__ eatin later but i'm eatin wif my frens now lei... __ going home first? ,0
1065,"Sorry man, my stash ran dry last night and I can't pick up more until sunday",0
1066,Hai priya are you right. What doctor said pa. Where are you.,0
1067,"Free msg. Sorry, a service you ordered from 81303 could not be delivered as you do not have sufficient credit. Please top up to receive the service.",1
1068,Ok...,0
1069,Please ask mummy to call father,0
1070,Can come my room but cannot come my house cos my house still messy... Haha...,0
1071,I have lost 10 kilos as of today!,0
1072,What can i do? Might accidant tookplace between somewhere ghodbandar rd. Traffic moves slovely. So plz slip &amp; don't worry.,0
1073,Yun ah.now __ wkg where?btw if __ go nus sc. __ wana specialise in wad?,0
1074,Yes! I am a one woman man! Please tell me your likes and dislikes in bed...,0
1075,Was doing my test earlier. I appreciate you. Will call you tomorrow.,0
1076,"How's my loverboy doing ? What does he do that keeps him from coming to his Queen, hmmm ? Doesn't he ache to speak to me ? Miss me desparately ?",0
1077,U meet other fren dun wan meet me ah... Muz b a guy rite...,0
1078,"(No promises on when though, haven't even gotten dinner yet)",0
1079,o turns out i had stereo love on mi phone under the unknown album.,0
1080,Yeah I don't see why not,0
1081,Asking do u knw them or nt? May be ur frnds or classmates?,0
1082,WOW! The Boys R Back. TAKE THAT 2007 UK Tour. Win VIP Tickets & pre-book with VIP Club. Txt CLUB to 81303. Trackmarque Ltd info@vipclub4u.,1
1083,"As in missionary hook up, doggy hook up, standing...|",0
1084,Then u better go sleep.. Dun disturb u liao.. U wake up then msg me lor..,0
1085,Am watching house ___ very entertaining ___ am getting the whole hugh laurie thing ___ even with the stick ___ indeed especially with the stick.,0
1086,Thought praps you meant another one. Goodo! I'll look tomorrow ,0
1087,I went to project centre,0
1088,As per your request 'Maangalyam (Alaipayuthe)' has been set as your callertune for all Callers. Press *9 to copy your friends Callertune,0
1089,Doing project w frens lor. ,0
1090,"Hi, this is Mandy Sullivan calling from HOTMIX FM...you are chosen to receive å£5000.00 in our Easter Prize draw.....Please telephone 09041940223 to claim before 29/03/05 or your prize will be transferred to someone else....",1
1091,I will come tomorrow di,0
1092,I cant pick the phone right now. Pls send a message,0
1093,U guys never invite me anywhere :(,0
1094,UR GOING 2 BAHAMAS! CallFREEFONE 08081560665 and speak to a live operator to claim either Bahamas cruise ofå£2000 CASH 18+only. To opt out txt X to 07786200117,1
1095,I can do that! I want to please you both inside and outside the bedroom...,0
1096,"\EY! CALM DOWNON THEACUSATIONS.. ITXT U COS IWANA KNOW WOTU R DOIN AT THEW/END... HAVENTCN U IN AGES..RING ME IF UR UP4 NETHING SAT.LOVE J XXX.\""""",0
1097,I love to wine and dine my lady!,0
1098,Someone has conacted our dating service and entered your phone because they fancy you!To find out who it is call from landline 09111030116. PoBox12n146tf15,1
1099,"Iå_m cool ta luv but v.tired 2 cause i have been doin loads of planning all wk, we have got our social services inspection at the nursery! Take care & spk sn x.",0
1100,I think u have the wrong number.,0
1101,Feel Yourself That You Are Always Happy.. Slowly It Becomes Your Habit &amp; Finally It Becomes Part Of Your Life.. Follow It.. Happy Morning &amp; Have A Happy Day:),0
1102,DO NOT B LATE LOVE MUM,0
1103,Got it..mail panren paru..,0
1104,Give one miss from that number please,0
1105,How is your schedule next week? I am out of town this weekend.,0
1106,Really good:)dhanush rocks once again:),0
1107,Lmao ok I wont be needing u to do my hair anymore.,0
1108,"Miss ya, need ya, want ya, love ya.",0
1109,Sorry i'm not free...,0
1110,Do u ever get a song stuck in your head for no reason and it won't go away til u listen to it like 5 times?,0
1111,Nt yet chikku..simple habba..hw abt u?,0
1112,Sometimes Heart Remembrs someone Very much... Forgets someone soon... Bcoz Heart will not like everyone. But liked ones will be Remembered Everytime... BSLVYL,0
1113,Joy's father is John. Then John is the NAME of Joy's father. Mandan,0
1114,Hi this is yijue... It's regarding the 3230 textbook it's intro to algorithms second edition... I'm selling it for $50...,0
1115,SMS AUCTION You have won a Nokia 7250i. This is what you get when you win our FREE auction. To take part send Nokia to 86021 now. HG/Suite342/2Lands Row/W1JHL 16+,1
1116,How. Its a little difficult but its a simple way to enter this place,0
1117,Ha... Both of us doing e same thing. But i got tv 2 watch. U can thk of where 2 go tonight or u already haf smth in mind...,0
1118,Watching tv now. I got new job :),0
1119,"Good afternoon sexy buns! How goes the job search ? I wake and you are my first thought as always, my love. I wish your fine and happy and know I adore you!",0
1120,Did u see what I posted on your Facebook?,0
1121,Call FREEPHONE 0800 542 0578 now!,1
1122,"7 wonders in My WORLD 7th You 6th Ur style 5th Ur smile 4th Ur Personality 3rd Ur Nature 2nd Ur SMS and 1st \Ur Lovely Friendship\""... good morning dear""",0
