,message,label
2281,"Hello, As per request from  &lt;#&gt;  Rs.5 has been transfered to you",0
2282,You are a winner you have been specially selected to receive å£1000 cash or a å£2000 award. Speak to a live operator to claim call 087147123779am-7pm. Cost 10p,1
2283,S:)but he had some luck.2 catches put down:),0
2284,Shall i get my pouch?,0
2285,"How is my boy? No sweet words left for me this morning ... *sighs* ... How goes you day, my love ? Did you start your studying?",0
2286,Ok. Very good. Its all about making that money.,0
2287,Reading gud habit.. Nan bari hudgi yorge pataistha ertini kano:-),0
2288,Aight do you still want to get money,0
2289,Free Top ringtone -sub to weekly ringtone-get 1st week free-send SUBPOLY to 81618-?3 per week-stop sms-08718727870,1
2290,Ok.ok ok..then..whats ur todays plan,0
2291,ARE YOU IN TOWN? THIS IS V. IMPORTANT,0
2292,Wat u doing there?,0
2293,"Oh, i will get paid. The most outstanding one is for a commercial i did for Hasbro...in AUGUST! They made us jump through so many hoops to get paid. Still not.",0
2294,"I am late,so call you tomorrow morning.take care sweet dreams....u and me...ummifying...bye.",0
2295,Cool. Do you like swimming? I have a pool and jacuzzi at my house.,0
2296,"Thanks for your ringtone order, reference number X49. Your mobile will be charged 4.50. Should your tone not arrive please call customer services 09065989182. From: [colour=red]text[/colour]TXTstar",1
2297,Blank is Blank. But wat is blank? Lol,0
2298,We left already we at orchard now.,0
2299,"Hi there, 2nights ur lucky night! Uve been invited 2 XCHAT, the Uks wildest chat! Txt CHAT to 86688 now! 150p/MsgrcvdHG/Suite342/2Lands/Row/W1J6HL LDN 18yrs",1
2300,No chikku nt yet.. Ya i'm free,0
2301,"Aldrine, rakhesh ex RTM here.pls call.urgent.",0
2302,The search 4 happiness is 1 of d main sources of unhappiness! Accept life the way it comes! U will find happiness in every moment u live.,0
2303,"I guess you could be as good an excuse as any, lol.",0
2304,Gud mrng dear hav a nice day,0
2305,Old Orchard near univ. How about you?,0
2306,"It__÷s å£6 to get in, is that ok?",0
2307,Hows the street where the end of library walk is?,0
2308,"Plz note: if anyone calling from a mobile Co. &amp; asks u to type # &lt;#&gt;  or # &lt;#&gt; . Do not do so. Disconnect the call,coz it iz an attempt of 'terrorist' to make use of the sim card no. Itz confirmd by nokia n motorola n has been verified by CNN IBN.",0
2309,We stopped to get ice cream and will go back after,0
2310,Did you stitch his trouser,0
2311,Hey i'm bored... So i'm thinking of u... So wat r u doing?,0
2312,"Nah, Wednesday. When should I bring the mini cheetos bag over?",0
2313,Nobody names their penis a girls name this story doesn't add up at all,0
2314,"A bit of Ur smile is my hppnss, a drop of Ur tear is my sorrow, a part of Ur heart is my life, a heart like mine wil care for U, forevr as my GOODFRIEND",0
2315,"Haha... Sounds crazy, dunno can tahan anot...",0
2316,Why are u up so early?,0
2317,YES! The only place in town to meet exciting adult singles is now in the UK. Txt CHAT to 86688 now! 150p/Msg.,1
2318,Lol no ouch but wish i'd stayed out a bit longer,0
2319,We'll join the  &lt;#&gt;  bus,0
2320,FREE for 1st week! No1 Nokia tone 4 ur mob every week just txt NOKIA to 8007 Get txting and tell ur mates www.getzed.co.uk POBox 36504 W45WQ norm150p/tone 16+,1
2321,K.i will send in  &lt;#&gt;  min:),0
2322,Would me smoking you out help us work through this difficult time,0
2323,"Sir Goodmorning, Once free call me.",0
2324,Love it! The girls at the office may wonder why you are smiling but sore...,0
2325,Does uncle timi help in clearing cars,0
2326,Ok... But bag again..,0
2327,Hi! You just spoke to MANEESHA V. We'd like to know if you were satisfied with the experience. Reply Toll Free with Yes or No.,0
2328,"Mila, age23, blonde, new in UK. I look sex with UK guys. if u like fun with me. Text MTALK to 69866.18 . 30pp/txt 1st 5free. å£1.50 increments. Help08718728876",1
2329,"Claim a 200 shopping spree, just call 08717895698 now! Have you won! MobStoreQuiz10ppm",1
2330,Then ur physics get a-?,0
2331,"Dear friends, sorry for the late information. Today is the birthday of our loving Ar.Praveesh. for more details log on to face book and see. Its his number + &lt;#&gt; . Dont miss a delicious treat.",0
2332,How r __ going to send it to me?,0
2333,Can you do online transaction?,0
2334,Dear got train and seat mine lower seat,0
2335,Wat r u doing?,0
2336,Are you sure you don't mean \get here,0
2337,"I love you !!! You know? Can you feel it? Does it make your belly warm? I wish it does, my love ... I shall meet you in your dreams, Ahmad ... *adoring kiss*",0
2338,Hey are you angry with me. Reply me dr.,0
2339,Also remember the beads don't come off. Ever.,0
2340,For The First Time In The History 'Need' 'Comfort' And 'Luxury' Are Sold At Same Price In India..!! Onion-Rs. &lt;#&gt;  Petrol-Rs. &lt;#&gt;  Beer-Rs. &lt;#&gt;  SHESIL  &lt;#&gt;,0
2341,"Feb  &lt;#&gt;  is \I LOVE U\"" day. Send dis to all ur \""VALUED FRNDS\"" evn me. If 3 comes back u'll gt married d person u luv! If u ignore dis u will lose ur luv 4 Evr""",0
2342,"Actually nvm, got hella cash, we still on for  &lt;#&gt; ish?",0
2343,We tried to contact you re your reply to our offer of a Video Handset? 750 anytime any networks mins? UNLIMITED TEXT? Camcorder? Reply or call 08000930705 NOW,1
2344,"No dude, its not fake..my frnds got money, thts y i'm reffering u..if u member wit my mail link, u vl be credited  &lt;#&gt; rs and il be getiing  &lt;#&gt; rs..i can draw my acc wen it is  &lt;#&gt; rs..",0
2345,Dude while were makin those weirdy brownies my sister made awesome cookies. I took pics.,0
2346,Pls dont restrict her from eating anythin she likes for the next two days.,0
2347,Pls i wont belive god.not only jesus.,0
2348,How long does it take to get it.,0
2349,This is my number by vivek..,0
2350,74355 XMAS iscoming & ur awarded either å£500 CD gift vouchers & free entry 2 r å£100 weekly draw txt MUSIC to 87066 TnC,1
2351,"I got arrested for possession at, I shit you not,  &lt;TIME&gt;  pm",0
2352,You are right though. I can't give you the space you want and need. This is really starting to become an issue. I was going to suggest setting a definite move out--if i'm still there-- after greece. But maybe you are ready and should do it now.,0
2353,"Please protect yourself from e-threats. SIB never asks for sensitive information like Passwords,ATM/SMS PIN thru email. Never share your password with anybody.",0
2354,I miss you so much I'm so desparate I have recorded the message you left for me the other day and listen to it just to hear the sound of your voice. I love you,0
2355,Hi. I'm always online on yahoo and would like to chat with you someday,0
2356,"Goodmorning,my grandfather expired..so am on leave today.",0
2357,Congratulations U can claim 2 VIP row A Tickets 2 C Blu in concert in November or Blu gift guaranteed Call 09061104276 to claim TS&Cs www.smsco.net costå£3.75max ,1
2358,I agree. So i can stop thinkin about ipad. Can you please ask macho the same question.,0
2359,Let's pool our money together and buy a bunch of lotto tickets. If we win I get &lt;#&gt; % u get &lt;#&gt; %. Deal?,0
2360,I had askd u a question some hours before. Its answer,0
2361,Watching tv lor. Nice one then i like lor.,0
2362,Then __ come n pick me at 530 ar?,0
2363,Early bird! Any purchases yet?,0
2364,Went to pay rent. So i had to go to the bank to authorise the payment.,0
2365,HEY MATE! HOWS U HONEY?DID U AVE GOOD HOLIDAY? GIMMI DE GOSS!x,0
2366,"chile, please! It's only a  &lt;DECIMAL&gt;  hour drive for me. I come down all the time and will be subletting feb-april for audition season.",0
2367,"Fantasy Football is back on your TV. Go to Sky Gamestar on Sky Active and play å£250k Dream Team. Scoring starts on Saturday, so register now!SKY OPT OUT to 88088",1
2368,Can you plz tell me the ans. BSLVYL sent via fullonsms.com,0
2369,U in town alone?,0
2370,I to am looking forward to all the sex cuddling.. Only two more sleeps ,0
2371,We have all rounder:)so not required:),0
2372,Free msg: Single? Find a partner in your area! 1000s of real people are waiting to chat now!Send CHAT to 62220Cncl send STOPCS 08717890890å£1.50 per msg,1
2373,"No! But we found a diff farm shop to buy some cheese. On way back now, can i call in?",0
2374,Yep. I do like the pink furniture tho.,0
2375,Free Msg: Ringtone!From: http://tms. widelive.com/index. wml?id=1b6a5ecef91ff9*37819&first=true18:0430-JUL-05,1
2376,"Customer place, i wil cal u sir.",0
2377,"Oh my god! I've found your number again! I'm so glad, text me back xafter this msgs cst std ntwk chg å£1.50",1
2378,A pure hearted person can have a wonderful smile that makes even his/her enemies to feel guilty for being an enemy.. So catch the world with your smile..:) GOODMORNING &amp; HAVE A SMILEY SUNDAY..:),0
2379,"Theoretically yeah, he could be able to come",0
2380,"Alright we're hooked up, where you guys at",0
2381,No let me do the math. Your not good at it.,0
2382,I am joining today formally.Pls keep praying.will talk later.,0
2383,No. Did you multimedia message them or e-mail?,0
2384,"Sorry sir, i will call you tomorrow.  senthil.hsbc",0
2385,What you need. You have a person to give na.,0
2386,Short But Cute: \Be a good person,0
2387,Unlimited texts. Limited minutes.,0
2388,"Double Mins & 1000 txts on Orange tariffs. Latest Motorola, SonyEricsson & Nokia with Bluetooth FREE! Call MobileUpd8 on 08000839402 or call2optout/HF8",1
2389,No problem. We will be spending a lot of quality time together...,0
2390,Dear Dave this is your final notice to collect your 4* Tenerife Holiday or #5000 CASH award! Call 09061743806 from landline. TCs SAE Box326 CW25WX 150ppm,1
2391,tells u 2 call 09066358152 to claim å£5000 prize. U have 2 enter all ur mobile & personal details @ the prompts. Careful!,1
2392,Otherwise had part time job na-tuition..,0
2393,__ mean it's confirmed... I tot they juz say oni... Ok then... ,0
2394,That depends. How would you like to be treated? :),0
2395,"Right on brah, see you later",0
2396,Waiting in e car 4 my mum lor. U leh? Reach home already?,0
2397,No that just means you have a fat head,0
2398,She.s good. She was wondering if you wont say hi but she.s smiling now. So how are you coping with the long distance,0
2399,How i noe... She's in da car now... Later then c lar... I'm wearing shorts...,0
2400,Today is ACCEPT DAY..U Accept me as? Brother Sister Lover Dear1 Best1 Clos1 Lvblefrnd Jstfrnd Cutefrnd Lifpartnr Belovd Swtheart Bstfrnd No rply means enemy,0
2401,Ard 530 lor. I ok then message __ lor.,0
2402,Ok. C u then.,0
2403,"Do 1 thing! Change that sentence into: \Because i want 2 concentrate in my educational career im leaving here..\""""",0
2404,As if i wasn't having enough trouble sleeping.,0
2405,I havent add __ yet right.. ,0
2406,Babe ? I lost you ... Will you try rebooting ?,0
2407,Yes. Nigh you cant aha.,0
2408,I thk __ gotta go home by urself. Cos i'll b going out shopping 4 my frens present. ,0
2409,Nooooooo I'm gonna be bored to death all day. Cable and internet outage.,0
2410,"Playin space poker, u?",0
2411,How come guoyang go n tell her? Then u told her?,0
2412,You need to get up. Now.,0
2413,They r giving a second chance to rahul dengra.,0
2414,Y __ wan to go there? C doctor?,0
2415,"Free Msg: get Gnarls Barkleys \Crazy\"" ringtone TOTALLY FREE just reply GO to this message right now!""",1
2416,I got a call from a landline number. . . I am asked to come to anna nagar . . . I will go in the afternoon,0
2417,I will be gentle princess! We will make sweet gentle love...,0
2418,"Sorry, went to bed early, nightnight",0
2419,Me hungry buy some food good lei... But mum n yun dun wan juz buy a little bit... ,0
2420,I probably won't eat at all today. I think I'm gonna pop. How was your weekend? Did u miss me?,0
2421,I knew it... U slept v late yest? Wake up so late...,0
2422,Where is that one day training:-),0
2423,So i could kiss and feel you next to me...,0
2424,I sent lanre fakeye's Eckankar details to the mail box,0
2425,Your dad is back in ph?,0
2426,If you ask her or she say any please message.,0
2427,Love you aathi..love u lot..,0
2428,I was just callin to say hi. Take care bruv!,0
2429,YOU HAVE WON! As a valued Vodafone customer our computer has picked YOU to win a å£150 prize. To collect is easy. Just call 09061743386,1
2430,Did u turn on the heater? The heater was on and set to &lt;#&gt; degrees.,0
2431,"That's the trouble with classes that go well - you're due a dodgey one ___ Expecting mine tomo! See you for recovery, same time, same place ",0
2432,WOT U UP 2 J?,0
2433,"Night night, see you tomorrow",0
2434,Roger that. We__÷re probably going to rem in about 20,0
2435,I wish u were here. I feel so alone,0
2436,Great NEW Offer - DOUBLE Mins & DOUBLE Txt on best Orange tariffs AND get latest camera phones 4 FREE! Call MobileUpd8 free on 08000839402 NOW! or 2stoptxt T&Cs,1
2437,Reason is if the team budget is available at last they buy the unsold players for at base rate..,0
2438,Huh i cant thk of more oredi how many pages do we have?,0
2439,Ringtone Club: Gr8 new polys direct to your mobile every week !,1
2440,"Hello. Sort of out in town already. That . So dont rush home, I am eating nachos. Will let you know eta.",0
2441,(Bank of Granite issues Strong-Buy) EXPLOSIVE PICK FOR OUR MEMBERS *****UP OVER 300% *********** Nasdaq Symbol CDGT That is a $5.00 per..,1
2442,"Dizzamn, aight I'll ask my suitemates when I get back",0
2443,Bored housewives! Chat n date now! 0871750.77.11! BT-national rate 10p/min only from landlines!,1
2444,We tried to call you re your reply to our sms for a video mobile 750 mins UNLIMITED TEXT free camcorder Reply or call now 08000930705 Del Thurs,1
2445,He's just gonna worry for nothing. And he won't give you money its no use.,0
2446,Did you get any gift? This year i didnt get anything. So bad,0
2447,somewhere out there beneath the pale moon light someone think in of u some where out there where dreams come true... goodnite &amp; sweet dreams,0
2448,Well there's a pattern emerging of my friends telling me to drive up and come smoke with them and then telling me that I'm a weed fiend/make them smoke too much/impede their doing other things so you see how I'm hesitant,0
2449,IM FINE BABES AINT BEEN UP 2 MUCH THO! SAW SCARY MOVIE YEST ITS QUITE FUNNY! WANT 2MRW AFTERNOON? AT TOWN OR MALL OR SUMTHIN?xx,0
2450,"Forgot you were working today! Wanna chat, but things are ok so drop me a text when you're free / bored etc and i'll ring. Hope all is well, nose essay and all xx",0
2451,Ha... Then we must walk to everywhere... Cannot take tram. My cousin said can walk to vic market from our hotel ,0
2452,"Wan2 win a Meet+Greet with Westlife 4 U or a m8? They are currently on what tour? 1)Unbreakable, 2)Untamed, 3)Unkempt. Text 1,2 or 3 to 83049. Cost 50p +std text",1
2453,Please call our customer service representative on FREEPHONE 0808 145 4742 between 9am-11pm as you have WON a guaranteed å£1000 cash or å£5000 prize!,1
2454,Discussed with your mother ah?,0
2455,You will be receiving this week's Triple Echo ringtone shortly. Enjoy it!,1
2456,"U've been selected to stay in 1 of 250 top British hotels - FOR NOTHING! Holiday valued at å£350! Dial 08712300220 to claim - National Rate Call. Bx526, SW73SS",1
2457,We have to pick rayan macleran there.,0
2458,Wat time __ wan today?,0
2459, &lt;#&gt;  in mca. But not conform.,0
2460,Oh ok.. Wat's ur email?,0
2461,"[___] anyway, many good evenings to u! s",0
2462,"Sorry vikky, i'm Watching olave mandara movie kano in trishul theatre wit my frnds..",0
2463,I'm very happy for you babe ! Woo hoo party on dude!,0
2464,I am taking you for italian food. How about a pretty dress with no panties? :),0
2465,Wot u up 2? Thout u were gonna call me!! Txt bak luv K,0
2466,How are you holding up?,0
2467,Dont flatter yourself... Tell that man of mine two pints of carlin in ten minutes please.... ,0
2468,Hope you are not scared!,0
2469,I'm at home n ready...,0
2470,Please call our customer service representative on FREEPHONE 0808 145 4742 between 9am-11pm as you have WON a guaranteed å£1000 cash or å£5000 prize!,1
2471,What time do u get out?,0
2472,I am literally in bed and have been up for like  &lt;#&gt;  hours,0
2473,"Yes, my reg is  Ciao!",0
2474,If You mean the website. Yes.,0
2475,Win a å£1000 cash prize or a prize worth å£5000,1
2476,"Thanks for your ringtone order, reference number X49.Your mobile will be charged 4.50. Should your tone not arrive please call customer services 09065989182",1
2477,I was slept that time.you there?,0
2478,"Ha ha nan yalrigu heltini..Iyo kothi chikku, u shared many things wit me..so far i didn't told any body and even uttered a word abt u.. If ur trusting me so much how can i tell these to others.. Plz nxt time dont use those words to me..ok, chikku:-);-)B-)",0
2479,Hi di is yijue we're meeting at 7 pm at esaplanade tonight.,0
2480,Moby Pub Quiz.Win a å£100 High Street prize if u know who the new Duchess of Cornwall will be? Txt her first name to 82277.unsub STOP å£1.50 008704050406 SP,1
2481,"This weeks SavaMob member offers are now accessible. Just call 08709501522 for details! SavaMob, POBOX 139, LA3 2WU. Only å£1.50/week. SavaMob - offers mobile!",1
2482,"Aight I've been set free, think you could text me blake's address? It occurs to me I'm not quite as sure what I'm doing as I thought I was",0
2483,Hi dear we saw dear. We both are happy. Where you my battery is low,0
2484,How are you. Its been ages. How's abj,0
2485,Prof: you have passed in all the papers in this sem congrats . . . . Student: Enna kalaachutaarama..!! Prof:???? Gud mrng!,0
2486,Dont kick coco when he's down,0
2487,Fyi I'm gonna call you sporadically starting at like  &lt;#&gt;  bc we are not not doin this shit,0
2488,TBS/PERSOLVO. been chasing us since Sept forå£38 definitely not paying now thanks to your information. We will ignore them. Kath. Manchester.,1
2489,Ok i wont call or disturb any one. I know all are avoiding me. I am a burden for all,0
2490,Loans for any purpose even if you have Bad Credit! Tenants Welcome. Call NoWorriesLoans.com on 08717111821,1
2491,Was the actual exam harder than NBME,0
2492,A lot of this sickness thing going round. Take it easy. Hope u feel better soon. Lol,0
2493,Hey sathya till now we dint meet not even a single time then how can i saw the situation sathya.,0
2494,Gam gone after outstanding innings.,0
2495,O i played smash bros  &lt;#&gt;  religiously.,0
2496,"Sir, good morning. Hope you had a good weekend. I called to let you know that i was able to raise  &lt;#&gt;  from my dad. He however said he would make the rest available by mid feb. This amount is still quite short and i was hoping you would help. Do have a good day. Abiola",0
2497,Hurry home. Soup is DONE!,0
2498,"Good afternoon, my love. It was good to see your words on YM and get your tm. Very smart move, my slave ... *smiles* ... I drink my coffee and await you.",0
2499,"Orange brings you ringtones from all time Chart Heroes, with a free hit each week! Go to Ringtones & Pics on wap. To stop receiving these tips reply STOP.",1
2500,Lemme know when you're here,0
2501,PRIVATE! Your 2003 Account Statement for 07973788240 shows 800 un-redeemed S. I. M. points. Call 08715203649 Identifier Code: 40533 Expires 31/10/04,1
2502,He needs to stop going to bed and make with the fucking dealing,0
2503,"How are you, my Love ? Are you with your brother ? Time to talk english with him ? *grins* Say : Hey Muhommad, Penny says hello from across the sea",0
2504,"Hey doc pls I want to get nice t shirt for my hubby nice fiting ones my budget is  &lt;#&gt; k help pls I will load d card abi hw,keep me posted luv. 2 mj",0
2505,"\Life is nothing wen v get everything\"". But \""life is everything wen v miss something \"". Real value of people wil be realized only in their absence.... gud mrng""",0
2506,how are you? I miss you!,0
2507,i am going to bed now prin,0
2508,I think just yourself ___Thanks and see you tomo,0
2509,If u dun drive then how i go 2 sch.,0
2510,I not at home now lei...,0
2511,Ok then i will come to ur home after half an hour,0
2512,Do u hav any frnd by name ashwini in ur college?,0
2513,Jus finish my lunch on my way home lor... I tot u dun wan 2 stay in sch today...,0
2514,"HOT LIVE FANTASIES call now 08707500020 Just 20p per min NTT Ltd, PO Box 1327 Croydon CR9 5WB 0870 is a national rate call",1
2515,Pls send me your address sir.,0
2516,I want to lick your pussy now...,0
2517,"Yo, you gonna still be in stock tomorrow/today? I'm trying to get a dubsack",0
2518,URGENT! Your Mobile number has been awarded a <UKP>2000 prize GUARANTEED. Call 09061790125 from landline. Claim 3030. Valid 12hrs only 150ppm,1
2519,Thought we could go out for dinner. I'll treat you! Seem ok?,0
2520,Where are you ? What do you do ? How can you stand to be away from me ? Doesn't your heart ache without me ? Don't you wonder of me ? Don't you crave me ?,0
2521,What you doing?how are you?,0
2522,"Sure thing big man. i have hockey elections at 6, shouldn__÷t go on longer than an hour though",0
2523,Hiya do u like the hlday pics looked horrible in them so took mo out! Hows the camp Amrca thing? Speak soon Serena:),0
2524,Yunny... I'm goin to be late,0
2525,"Hey sexy buns ! Have I told you ? I adore you, loverboy. I hope you remember to thank your sister in law for those meatballs *grins* ... i love you, babe",0
2526,"SPJanuary Male Sale! Hot Gay chat now cheaper, call 08709222922. National rate from 1.5p/min cheap to 7.8p/min peak! To stop texts call 08712460324 (10p/min)",1
2527,"Sorry, I'll call later",0
2528,And by when you're done I mean now,0
2529,\Its Ur luck to Love someone. Its Ur fortune to Love the one who Loves U. But,0
2530,FreeMsg Today's the day if you are ready! I'm horny & live in your town. I love sex fun & games! Netcollex Ltd 08700621170150p per msg reply Stop to end,1
2531,Is it your yahoo boys that bring in the perf? Or legal.,0
2532,have you ever had one foot before?,0
2533,Leave it wif me lar... __ wan to carry meh so heavy... Is da num 98321561 familiar to __?,0
2534,Infact happy new year. How are you where are you when are we seeing,0
2535,"In The Simpsons Movie released in July 2007 name the band that died at the start of the film? A-Green Day, B-Blue Day, C-Red Day. (Send A, B or C)",1
2536,That's a shame! Maybe cld meet for few hrs tomo?,0
2537,Lol I would but despite these cramps I like being a girl.,0
2538,Please call Amanda with regard to renewing or upgrading your current T-Mobile handset free of charge. Offer ends today. Tel 0845 021 3680 subject to T's and C's,1
2539,"Haven't found a way to get another app for your phone, eh ? Will you go to the net cafe ? Did you take that job? Geeee I need you babe. I crave to see you ...",0
2540,__ comin to fetch us oredi...,0
2541,What's nannys address?,0
2542,"URGENT!! Your 4* Costa Del Sol Holiday or å£5000 await collection. Call 09050090044 Now toClaim. SAE, TC s, POBox334, Stockport, SK38xh, Costå£1.50/pm, Max10mins",1
2543,Want a new Video Phone? 750 anytime any network mins? Half price line rental free text for 3 months? Reply or call 08000930705 for free delivery,1
2544,"Yo, call me when you get the chance, a friend of mine wanted me to ask you about a big order",0
2545,This single single answers are we fighting? Plus i said am broke and you didnt reply,0
2546,i felt so...not any conveying reason.. Ese he... What about me?,0
2547,Had your mobile 11 months or more? U R entitled to Update to the latest colour mobiles with camera for Free! Call The Mobile Update Co FREE on 08002986030,1
2548,"Dear Voucher Holder, To claim this weeks offer, at your PC please go to http://www.wtlp.co.uk/text. Ts&Cs apply.",1
2549,Well if I'm that desperate I'll just call armand again,0
2550,Are you at work right now ?,0
2551,"Mmmmmm ... I love you,so much, Ahmad ... I can't wait for this year to begin as every second takes me closer to being at your side. Happy New Year, my love!!",0
2552,And pls pls drink plenty plenty water,0
2553,He's in lag. That's just the sad part but we keep in touch thanks to skype,0
2554,Ok lor then we go tog lor...,0
2555,Can __ send me a copy of da report?,0
2556,"swhrt how u dey,hope ur ok, tot about u 2day.love n miss.take care.",0
2557,"Ok da, i already planned. I wil pick you.",0
2558,"Urgent! Please call 0906346330. Your ABTA complimentary 4* Spanish Holiday or å£10,000 cash await collection SAE T&Cs BOX 47 PO19 2EZ 150ppm 18+",1
2559,"Sorry, I'll call later in meeting",0
2560,I'm good. Have you registered to vote?,0
2561,Dear got bus directly to calicut,0
2562,"Sorry, I'll call later",0
2563,&lt;#&gt;  w jetton ave if you forgot,0
2564,Ok i'm coming home now.,0
2565,"Sorry, it's a lot of friend-of-a-friend stuff, I'm just now about to talk to the actual guy who wants to buy",0
2566,"Want to funk up ur fone with a weekly new tone reply TONES2U 2 this text. www.ringtones.co.uk, the original n best. Tones 3GBP network operator rates apply",1
2567,I will come tomorrow di,0
2568,Wylie update: my weed dealer carlos went to freedom and had a class with lunsford,0
2569,C movie is juz last minute decision mah. Juz watch 2 lar but i tot __ not interested.,0
2570,How are you enjoying this semester? Take care brother.,0
2571,I want kfc its Tuesday. Only buy 2 meals ONLY 2. No gravy. Only 2 Mark. 2!,0
2572,No da:)he is stupid da..always sending like this:)don believe any of those message.pandy is a mental:),0
2573,I attended but nothing is there.,0
