,message,label
0,"Go until jurong point, crazy.. Available only in bugis n great world la e buffet... Cine there got amore wat...",0
1,Free entry in 2 a wkly comp to win FA Cup final tkts 21st May 2005. Text FA to 87121 to receive entry question(std txt rate)T&C's apply 08452810075over18's,1
2,U dun say so early hor... U c already then say...,0
3,"FreeMsg Hey there darling it's been 3 week's now and no word back! I'd like some fun you up for it still? Tb ok! XxX std chgs to send, å£1.50 to rcv",1
4,Even my brother is not like to speak with me. They treat me like aids patent.,0
5,As per your request 'Melle Melle (Oru Minnaminunginte Nurungu Vettam)' has been set as your callertune for all Callers. Press *9 to copy your friends Callertune,0
6,Had your mobile 11 months or more? U R entitled to Update to the latest colour mobiles with camera for Free! Call The Mobile Update Co FREE on 08002986030,1
7,"URGENT! You have won a 1 week FREE membership in our å£100,000 Prize Jackpot! Txt the word: CLAIM to No: 81010 T&C www.dbuk.net LCCLTD POBOX 4403LDNW1A7RW18",1
8,I've been searching for the right words to thank you for this breather. I promise i wont take your help for granted and will fulfil my promise. You have been wonderful and a blessing at all times.,0
9,I HAVE A DATE ON SUNDAY WITH WILL!!,0
10,"XXXMobileMovieClub: To use your credit, click the WAP link in the next txt message or click here>> http://wap. xxxmobilemovieclub.com?n=QJKGIGHJJGCBL",1
11,Eh u remember how 2 spell his name... Yes i did. He v naughty make until i v wet.,0
12,Fine if thatå_s the way u feel. Thatå_s the way its gota b,0
13,So __ pay first lar... Then when is da stock comin...,0
14,Aft i finish my lunch then i go str down lor. Ard 3 smth lor. U finish ur lunch already?,0
15,Lol your always so convincing.,0
16,Ahhh. Work. I vaguely remember that! What does it feel like? Lol,0
17,Yeah he got in at 2 and was v apologetic. n had fallen out and she was actin like spoilt child and he got caught up in that. Till 2! But we won't go there! Not doing too badly cheers. You? ,0
18,For fear of fainting with the of all that housework you just did? Quick have a cuppa,0
19,Thanks for your subscription to Ringtone UK your mobile will be charged å£5/month Please confirm by replying YES or NO. If you reply NO you will not be charged,1
20,I see the letter B on my car,0
21,Anything lor... U decide...,0
22,Hello! How's you and how did saturday go? I was just texting to see if you'd decided to do anything tomo. Not that i'm trying to invite myself or anything!,0
23,Pls go ahead with watts. I just wanted to be sure. Do have a great weekend. Abiola,0
24,"Did I forget to tell you ? I want you , I need you, I crave you ... But most of all ... I love you my sweet Arabian steed ... Mmmmmm ... Yummy",0
25,WHO ARE YOU SEEING?,0
26,Great! I hope you like your man well endowed. I am  &lt;#&gt;  inches...,0
27,No calls..messages..missed calls,0
28,Didn't you get hep b immunisation in nigeria.,0
29,"Fair enough, anything going on?",0
30,"Yeah hopefully, if tyler can't do it I could maybe ask around a bit",0
31,U don't know how stubborn I am. I didn't even want to go to the hospital. I kept telling Mark I'm not a weak sucker. Hospitals are for weak suckers.,0
32,What you thinked about me. First time you saw me in class.,0
33,"A gram usually runs like  &lt;#&gt; , a half eighth is smarter though and gets you almost a whole second gram for  &lt;#&gt;",0
34,K fyi x has a ride early tomorrow morning but he's crashing at our place tonight,0
35,"Wow. I never realized that you were so embarassed by your accomodations. I thought you liked it, since i was doing the best i could and you always seemed so happy about \the cave\"". I'm sorry I didn't and don't have more to give. I'm sorry i offered. I'm sorry your room was so embarassing.""",0
36,SMS. ac Sptv: The New Jersey Devils and the Detroit Red Wings play Ice Hockey. Correct or Incorrect? End? Reply END SPTV,1
37,Do you know what Mallika Sherawat did yesterday? Find out now @  &lt;URL&gt;,0
38,"Sorry, I'll call later in meeting.",0
39,Tell where you reached,0
40,Yes..gauti and sehwag out of odi series.,0
41,Ha ha ha good joke. Girls are situation seekers.,0
42,Its a part of checking IQ,0
43,"As a valued customer, I am pleased to advise you that following recent review of your Mob No. you are awarded with a å£1500 Bonus Prize, call 09066364589",1
44,"Today is \song dedicated day..\"" Which song will u dedicate for me? Send this to all ur valuable frnds but first rply me...""",0
45,"Did you hear about the new \Divorce Barbie\""? It comes with all of Ken's stuff!""",1
46,Finished class where are you.,0
47,HI BABE IM AT HOME NOW WANNA DO SOMETHING? XX,0
48,K..k:)where are you?how did you performed?,0
49,Thats cool. i am a gentleman and will treat you with dignity and respect.,0
50,I like you peoples very much:) but am very shy pa.,0
51,Does not operate after  &lt;#&gt;  or what,0
52,"Sorry, I'll call later",0
53,K. Did you call me just now ah? ,0
54,Yup next stop.,0
55,Yes I started to send requests to make it but pain came back so I'm back in bed. Double coins at the factory too. I gotta cash in all my nitros.,0
56,"Ela kano.,il download, come wen ur free..",0
57,Yeah do! Don__÷t stand to close tho- you__÷ll catch something!,0
58,Smile in Pleasure Smile in Pain Smile when trouble pours like Rain Smile when sum1 Hurts U Smile becoz SOMEONE still Loves to see u Smiling!!,0
59,Please call our customer service representative on 0800 169 6031 between 10am-9pm as you have WON a guaranteed å£1000 cash or å£5000 prize!,1
60,Havent planning to buy later. I check already lido only got 530 show in e afternoon. U finish work already?,0
61,"Your free ringtone is waiting to be collected. Simply text the password \MIX\"" to 85069 to verify. Get Usher and Britney. FML",1
62,Watching telugu movie..wat abt u?,0
63,i see. When we finish we have loads of loans to pay,0
64,Please don't text me anymore. I have nothing else to say.,0
65,I'm still looking for a car to buy. And have not gone 4the driving test yet.,0
66,Thanks a lot for your wishes on my birthday. Thanks you for making my birthday truly memorable.,0
67,How would my ip address test that considering my computer isn't a minecraft server,0
68,What is the plural of the noun research?,0
69,Going for dinner.msg you after.,0
70,GENT! We are trying to contact you. Last weekends draw shows that you won a å£1000 prize GUARANTEED. Call 09064012160. Claim Code K52. Valid 12hrs only. 150ppm,1
71,"Wa, ur openin sentence very formal... Anyway, i'm fine too, juz tt i'm eatin too much n puttin on weight...Haha... So anythin special happened?",0
72,"As I entered my cabin my PA said, '' Happy B'day Boss !!''. I felt special. She askd me 4 lunch. After lunch she invited me to her apartment. We went there.",0
73,Hmm...my uncle just informed me that he's paying the school directly. So pls buy food.,0
74,"URGENT! Your Mobile No. was awarded å£2000 Bonus Caller Prize on 5/9/03 This is our final try to contact U! Call from Landline 09064019788 BOX42WR29C, 150PPM",1
75,here is my new address -apples&pairs&all that malarky,0
76,Todays Voda numbers ending 7548 are selected to receive a $350 award. If you have a match please call 08712300220 quoting claim code 4041 standard rates app,1
77,"Good stuff, will do.",0
78,"Just so that you know,yetunde hasn't sent money yet. I just sent her a text not to bother sending. So its over, you dont have to involve yourself in anything. I shouldn't have imposed anything on you in the first place so for that, i apologise.",0
79,Are you there in room.,0
80,K..k:)how much does it cost?,0
81,"Dear, will call Tmorrow.pls accomodate.",0
82,Want 2 get laid tonight? Want real Dogging locations sent direct 2 ur mob? Join the UK's largest Dogging Network bt Txting GRAVEL to 69888! Nt. ec2a. 31p.msg@150p,1
83,He is there. You call and meet him,0
84,You'll not rcv any more msgs from the chat svc. For FREE Hardcore services text GO to: 69988 If u get nothing u must Age Verify with yr network & try again,1
85,"K, text me when you're on the way",0
86,"Sir, Waiting for your mail.",0
87,I know you are. Can you pls open the back?,0
88,Whats the staff name who is taking class for us?,0
89,Ummma.will call after check in.our life will begin from qatar so pls pray very hard.,0
90,Ok... Ur typical reply...,0
91,"You are everywhere dirt, on the floor, the windows, even on my shirt. And sometimes when i open my mouth, you are all that comes flowing out. I dream of my world without you, then half my chores are out too. A time of joy for me, lots of tv shows i.ll see. But i guess like all things you just must exist, like rain, hail and mist, and when my time here is done, you and i become one.",0
92,I'm leaving my house now...,0
93,"Hello, my love. What are you doing? Did you get to that interview today? Are you you happy? Are you being a good boy? Do you think of me?Are you missing me ?",0
94,You are a winner U have been specially selected 2 receive å£1000 cash or a 4* holiday (flights inc) speak to a live operator 2 claim 0871277810810,1
95,Keep yourself safe for me because I need you and I miss you already and I envy everyone that see's you in real life,0
96,New car and house for my parents.:)i have only new job in hand:),0
97,I'm so in love with you. I'm excited each day i spend with you. You make me so happy.,0
98,-PLS STOP bootydelious (32/F) is inviting you to be her friend. Reply YES-434 or NO-434 See her: www.SMS.ac/u/bootydelious STOP? Send STOP FRND to 62468,1
99,"BangBabes Ur order is on the way. U SHOULD receive a Service Msg 2 download UR content. If U do not, GoTo wap. bangb. tv on UR mobile internet/service menu",1
100,I place all ur points on e cultures module already.,0
101,URGENT! We are trying to contact you. Last weekends draw shows that you have won a å£900 prize GUARANTEED. Call 09061701939. Claim code S89. Valid 12hrs only,1
102,Yes :)it completely in out of form:)clark also utter waste.,0
103,"Hmmm.. Thk sure got time to hop ard... Ya, can go 4 free abt... Muz call u to discuss liao... ",0
104,What time you coming down later? ,0
105,"Turns out my friends are staying for the whole show and won't be back til ~ &lt;#&gt; , so feel free to go ahead and smoke that $ &lt;#&gt;  worth",0
106,Hi! You just spoke to MANEESHA V. We'd like to know if you were satisfied with the experience. Reply Toll Free with Yes or No.,0
107,Lol no. U can trust me.,0
108,"He will, you guys close?",0
109,Please call our customer service representative on FREEPHONE 0808 145 4742 between 9am-11pm as you have WON a guaranteed å£1000 cash or å£5000 prize!,1
110,Have you got Xmas radio times. If not i will get it now,0
111,I jus reached home. I go bathe first. But my sis using net tell u when she finishes k...,0
112,Hi :)finally i completed the course:),0
113,It will stop on itself. I however suggest she stays with someone that will be able to give ors for every stool.,0
114,How are you doing? Hope you've settled in for the new school year. Just wishin you a gr8 day,0
115,Gud mrng dear hav a nice day,0
116,Did u got that persons story,0
117,is your hamster dead? Hey so tmr i meet you at 1pm orchard mrt? ,0
118,"Found it, ENC  &lt;#&gt; , where you at?",0
119,I sent you  &lt;#&gt;  bucks,0
120,Hello darlin ive finished college now so txt me when u finish if u can love Kate xxx,0
121,Goodmorning sleeping ga.,0
122,__ say until like dat i dun buy ericsson oso cannot oredi lar...,0
123,"As I entered my cabin my PA said, '' Happy B'day Boss !!''. I felt special. She askd me 4 lunch. After lunch she invited me to her apartment. We went there.",0
124,"Aight yo, dats straight dogg",0
125,You please give us connection today itself before  &lt;DECIMAL&gt;  or refund the bill,0
126,"What's up bruv, hope you had a great break. Do have a rewarding semester.",0
127,K:)k:)good:)study well.,0
128,Sounds great! Are you home now?,0
129,Finally the match heading towards draw as your prediction.,0
130,Easy ah?sen got selected means its good..,0
131,I have to take exam with march 3,0
132,Yeah you should. I think you can use your gt atm now to register. Not sure but if there's anyway i can help let me know. But when you do be sure you are ready.,0
133,Ok no prob. Take ur time.,0
134,There is os called ubandu which will run without installing in hard disk...you can use that os to copy the important files in system and give it to repair shop..,0
135,"500 New Mobiles from 2004, MUST GO! Txt: NOKIA to No: 89545 & collect yours today!From ONLY å£1 www.4-tc.biz 2optout 087187262701.50gbp/mtmsg18",1
136,Dear good morning now only i am up,0
137,Get down in gandhipuram and walk to cross cut road. Right side &lt;#&gt; street road and turn at first right.,0
138,Yes:)here tv is always available in work place..,0
139,Text & meet someone sexy today. U can find a date or even flirt its up to U. Join 4 just 10p. REPLY with NAME & AGE eg Sam 25. 18 -msg recd@thirtyeight pence,1
140,I have printed it oh. So  &lt;#&gt;  come upstairs,0
141,Or ill be a little closer like at the bus stop on the same street,0
142,Where are you?when wil you reach here?,0
143,U 447801259231 have a secret admirer who is looking 2 make contact with U-find out who they R*reveal who thinks UR so special-call on 09058094597,1
144,PLEASSSSSSSEEEEEE TEL ME V AVENT DONE SPORTSx,0
145,"Although i told u dat i'm into baig face watches now but i really like e watch u gave cos it's fr u. Thanx 4 everything dat u've done today, i'm touched...",0
146,U don't remember that old commercial?,0
147,I asked you to call him now ok,0
148,Kallis wont bat in 2nd innings.,0
149,Congratulations ur awarded 500 of CD vouchers or 125gift guaranteed & Free entry 2 100 wkly draw txt MUSIC to 87066 TnCs www.Ldew.com1win150ppmx3age16,1
150,Ranjith cal drpd Deeraj and deepak 5min hold,0
151,"Wen ur lovable bcums angry wid u, dnt take it seriously.. Coz being angry is d most childish n true way of showing deep affection, care n luv!.. kettoda manda... Have nice day da.",0
152,What you doing?how are you?,0
153,"Ups which is 3days also, and the shipping company that takes 2wks. The other way is usps which takes a week but when it gets to lag you may have to bribe nipost to get your stuff.",0
154,"I'm back, lemme know when you're ready",0
155,Don't necessarily expect it to be done before you get back though because I'm just now headin out,0
156,Mmm so yummy babe ... Nice jolt to the suzy,0
157,Where are you lover ? I need you ...,0
158,I__÷m parked next to a MINI!!!! When are you coming in today do you think?,0
159,Yup,0
160,Anyway i'm going shopping on my own now. Cos my sis not done yet. Dun disturb u liao.,0
161,Hey I am really horny want to chat or see me naked text hot to 69698 text charged at 150pm to unsubscribe text stop 69698,1
162,Why you Dint come with us.,0
163,Same. Wana plan a trip sometme then,0
164,"Not sure yet, still trying to get a hold of him",0
165,Ringtone Club: Get the UK singles chart on your mobile each week and choose any top quality ringtone! This message is free of charge.,1
166,"Come to mu, we're sorting out our narcotics situation",0
167,"Night has ended for another day, morning has come in a special way. May you smile like the sunny rays and leaves your worries at the blue blue bay.",0
168,"Usf I guess, might as well take 1 car",0
169,Tell rob to mack his gf in the theater,0
170,"Awesome, I'll see you in a bit",0
171,All done? All handed in? Celebrations in full swing yet?,0
172,You got called a tool?,0
173,Ok. I asked for money how far,0
174,Okie...,0
175,"K, I might come by tonight then if my class lets out early",0
176,Ok..,0
177,hi baby im cruisin with my girl friend what r u up 2? give me a call in and hour at home if thats alright or fone me on this fone now love jenny xxx,0
178,"Dear,shall mail tonite.busy in the street,shall update you tonite.things are looking ok.varunnathu edukkukayee raksha ollu.but a good one in real sense.",0
179,Haf u found him? I feel so stupid da v cam was working.,0
180,Are you this much buzy,0
181,I accidentally deleted the message. Resend please.,0
182,T-Mobile customer you may now claim your FREE CAMERA PHONE upgrade & a pay & go sim card for your loyalty. Call on 0845 021 3680.Offer ends 28thFeb.T&C's apply,1
183,Unless it's a situation where YOU GO GURL would be more appropriate,0
184,Hurt me... Tease me... Make me cry... But in the end of my life when i die plz keep one rose on my grave and say STUPID I MISS U.. HAVE A NICE DAY BSLVYL,0
185,I cant pick the phone right now. Pls send a message,0
186,"Awesome, I remember the last time we got somebody high for the first time with diesel :V",0
187,"Shit that is really shocking and scary, cant imagine for a second. Def up for night out. Do u think there is somewhere i could crash for night, save on taxi?",0
188,Oh and by the way you do have more food in your fridge! Want to go out for a meal tonight? ,0
189,"SMS. ac Blind Date 4U!: Rodds1 is 21/m from Aberdeen, United Kingdom. Check Him out http://img. sms. ac/W/icmb3cktz8r7!-4 no Blind Dates send HIDE",1
190,Yup... From what i remb... I think should be can book... ,0
191,Jos ask if u wana meet up?,0
192,Lol yes. Our friendship is hanging on a thread cause u won't buy stuff.,0
193,Where are the garage keys? They aren't on the bookshelf,0
194,Today is ACCEPT DAY..U Accept me as? Brother Sister Lover Dear1 Best1 Clos1 Lvblefrnd Jstfrnd Cutefrnd Lifpartnr Belovd Swtheart Bstfrnd No rply means enemy,0
195,"Think ur smart ? Win å£200 this week in our weekly quiz, text PLAY to 85222 now!T&Cs WinnersClub PO BOX 84, M26 3UZ. 16+. GBP1.50/week",1
196,He says he'll give me a call when his friend's got the money but that he's definitely buying before the end of the week,0
197,"Hi the way I was with u 2day, is the normal way&this is the real me. UR unique&I hope I know u 4 the rest of mylife. Hope u find wot was lost.",0
198,You made my day. Do have a great day too.,0
199,"Hmmm... Guess we can go 4 kb n power yoga... Haha, dunno we can tahan power yoga anot... Thk got lo oso, forgot liao...",0
200,"Not really dude, have no friends i'm afraid :(",0
201,December only! Had your mobile 11mths+? You are entitled to update to the latest colour camera mobile for Free! Call The Mobile Update Co FREE on 08002986906,1
202,"Coffee cake, i guess...",0
203,Hey... Why dont we just go watch x men and have lunch... Haha ,0
204,cud u tell ppl im gona b a bit l8 cos 2 buses hav gon past cos they were full & im still waitin 4 1. Pete x,0
205,No calls..messages..missed calls,0
206,"Cool, text me when you're parked",0
207,I'm reading the text i just sent you. Its meant to be a joke. So read it in that light,0
208,K.k:)apo k.good movie.,0
209,Call Germany for only 1 pence per minute! Call from a fixed line via access number 0844 861 85 85. No prepayment. Direct access!,1
210,Any chance you might have had with me evaporated as soon as you violated my privacy by stealing my phone number from your employer's paperwork. Not cool at all. Please do not contact me again or I will report you to your supervisor.,0
211,"Ta-Daaaaa! I am home babe, are you still up ?",0
212,Just sleeping..and surfing,0
213,"Sorry, I'll call later",0
214,I take it the post has come then! You must have 1000s of texts now! Happy reading. My one from wiv hello caroline at the end is my favourite. Bless him,0
215,Where u been hiding stranger?,0
216,My sister cleared two round in birla soft yesterday.,0
217,Gudnite....tc...practice going on,0
218,Dis is yijue. I jus saw ur mail. In case huiming havent sent u my num. Dis is my num.,0
219,One small prestige problem now.,0
220,Fancy a shag? I do.Interested? sextextuk.com txt XXUK SUZY to 69876. Txts cost 1.50 per msg. TnCs on website. X,1
221,"Nah can't help you there, I've never had an iphone",0
222,If you're not in my car in an hour and a half I'm going apeshit,0
223,"TODAY is Sorry day.! If ever i was angry with you, if ever i misbehaved or hurt you? plz plz JUST SLAP URSELF Bcoz, Its ur fault, I'm basically GOOD",0
224,&lt;#&gt; ISH MINUTES WAS 5 MINUTES AGO. WTF.,0
225,Congratulations ur awarded 500 of CD vouchers or 125gift guaranteed & Free entry 2 100 wkly draw txt MUSIC to 87066 TnCs www.Ldew.com1win150ppmx3age16,1
226,Ur cash-balance is currently 500 pounds - to maximize ur cash-in now send CASH to 86688 only 150p/msg. CC: 08708800282 HG/Suite342/2Lands Row/W1J6HL,1
227,"Hello! Just got here, st andrews-boy its a long way! Its cold. I will keep you posted",0
228,Ha ha cool cool chikku chikku:-):-DB-),0
229,Oh ok no prob..,0
230,Here is your discount code RP176781. To stop further messages reply stop. www.regalportfolio.co.uk. Customer Services 08717205546,1
231,"Hello my boytoy ... Geeee I miss you already and I just woke up. I wish you were here in bed with me, cuddling me. I love you ...",0
232,I will spoil you in bed as well :),0
233,I cant keep talking to people if am not sure i can pay them if they agree to price. So pls tell me what you want to really buy and how much you are willing to pay,0
234,"Thanks for your Ringtone Order, Reference T91. You will be charged GBP 4 per week. You can unsubscribe at anytime by calling customer services on 09057039994",1
235,Can you say what happen,0
236,You could have seen me..i did't recognise you Face.:),0
237,Keep my payasam there if rinu brings,0
238,I taught that Ranjith sir called me. So only i sms like that. Becaus hes verifying about project. Prabu told today so only pa dont mistake me..,0
239,"I guess that's why you re worried. You must know that there's a way the body repairs itself. And i'm quite sure you shouldn't worry. We'll take it slow. First the tests, they will guide when your ovulation is then just relax. Nothing you've said is a reason to worry but i.ll keep on followin you up.",0
240,"Yeah sure, give me a couple minutes to track down my wallet",0
241,Hey leave it. not a big deal:-) take care.,0
242,It took Mr owl 3 licks,0
243,Mm that time you dont like fun,0
244,4mths half price Orange line rental & latest camera phones 4 FREE. Had your phone 11mths ? Call MobilesDirect free on 08000938767 to update now! or2stoptxt,1
245,Yup having my lunch buffet now.. U eat already?,0
246,Huh so late... Fr dinner?,0
247,Morning only i can ok.,0
248,Yes i think so. I am in office but my lap is in room i think thats on for the last few days. I didnt shut that down,0
249,Pick you up bout 7.30ish? What time are  and that going?,0
250,"Good evening Sir, Al Salam Wahleykkum.sharing a happy news.By the grace of God, i got an offer from Tayseer,TISSCO and i joined.Hope you are fine.Inshah Allah,meet you sometime.Rakhesh,visitor from India.",0
251,"FREE RINGTONE text FIRST to 87131 for a poly or text GET to 87131 for a true tone! Help? 0845 2814032 16 after 1st free, tones are 3xå£150pw to eå£nd txt stop",1
252,Dear how is chechi. Did you talk to her,0
253,The hair cream has not been shipped.,0
254,None of that's happening til you get here though,0
255,"Yep, the great loxahatchee xmas tree burning of  &lt;#&gt;  starts in an hour",0
256,"Haha get used to driving to usf man, I know a lot of stoners",0
257,All was well until slightly disastrous class this pm with my fav darlings! Hope day off ok. Coffee wld be good as can't stay late tomorrow. Same time + place as always?,0
258,Headin towards busetop,0
259,Message:some text missing* Sender:Name Missing* *Number Missing *Sent:Date missing *Missing U a lot thats y everything is missing sent via fullonsms.com,0
260,Come by our room at some point so we can iron out the plan for this weekend,0
261,Cos i want it to be your thing,0
262,Bring home some Wendy =D,0
263,100 dating service cal;l 09064012103 box334sk38ch,1
264,Whatsup there. Dont u want to sleep,0
265,Alright i have a new goal now,0
266,FREE entry into our å£250 weekly competition just text the word WIN to 80086 NOW. 18 T&C www.txttowin.co.uk,1
267,"Alright, I'll head out in a few minutes, text me where to meet you",0
268,Send a logo 2 ur lover - 2 names joined by a heart. Txt LOVE NAME1 NAME2 MOBNO eg LOVE ADAM EVE 07123456789 to 87077 Yahoo! POBox36504W45WQ TxtNO 4 no ads 150p,1
269,Someone has contacted our dating service and entered your phone because they fancy you! To find out who it is call from a landline 09111032124 . PoBox12n146tf150p,1
270,Siva is in hostel aha:-.,0
271,Ok. She'll be ok. I guess,0
272,aathi..where are you dear..,0
273,Congrats! Nokia 3650 video camera phone is your Call 09066382422 Calls cost 150ppm Ave call 3mins vary from mobiles 16+ Close 300603 post BCM4284 Ldn WC1N3XX,1
274,You available now? I'm like right around hillsborough &amp;  &lt;#&gt; th,0
275,The message sent is askin for  &lt;#&gt; dollars. Shoul i pay  &lt;#&gt;  or  &lt;#&gt; ?,0
276,"Ask g or iouri, I've told the story like ten times already",0
277,How long does applebees fucking take,0
278,"Hi hope u get this txt~journey hasnt been gd,now about 50 mins late I think.",0
279,But i have to. I like to have love and arrange.,0
280,Oic... I saw him too but i tot he din c me... I found a group liao...,0
281,"Sorry, I'll call later",0
282,"Well done, blimey, exercise, yeah, i kinda remember wot that is, hmm. ",0
283,I wont get concentration dear you know you are my mind and everything :-),0
284,LOL ... Have you made plans for new years?,0
285,Thanks for this hope you had a good day today,0
286,Ok i will tell her to stay out. Yeah its been tough but we are optimistic things will improve this month.,0
287,Si si. I think ill go make those oreo truffles.,0
